{
  "$schema": "https://json-schema.org/draft/2020-12/schema",
  "$id": "urn:claimspec:v1:replay",
  "title": "claimspec v1 \u2014 bug replay",
  "description": "Would this suite have caught the bugs that actually escaped? For each fix commit in a range: revert only the source to its parent, remove the test the fix shipped, run what remains. `blind` means the suite was blind to a bug that really shipped. Unlike an injected fault, a replayed bug is ground truth \u2014 a human already confirmed it was a defect \u2014 which is what makes this the oracle a fault model is calibrated against.",
  "type": "object",
  "required": [
    "schemaVersion",
    "tool",
    "run",
    "records"
  ],
  "properties": {
    "$schema": {
      "type": "string"
    },
    "schemaVersion": {
      "const": 1
    },
    "tool": {
      "$ref": "urn:claimspec:v1:common#/$defs/tool"
    },
    "run": {
      "type": "object",
      "required": [
        "id",
        "startedAt",
        "range",
        "confirmRuns"
      ],
      "properties": {
        "id": {
          "type": "string",
          "minLength": 1,
          "maxLength": 128
        },
        "startedAt": {
          "$ref": "urn:claimspec:v1:common#/$defs/isoDateTime"
        },
        "finishedAt": {
          "$ref": "urn:claimspec:v1:common#/$defs/isoDateTime"
        },
        "range": {
          "description": "The commit range searched for fix commits, as given.",
          "type": "string",
          "minLength": 1,
          "maxLength": 256
        },
        "runner": {
          "type": "object",
          "required": [
            "name"
          ],
          "properties": {
            "name": {
              "type": "string"
            },
            "version": {
              "type": "string"
            }
          },
          "additionalProperties": false
        },
        "confirmRuns": {
          "type": "integer",
          "minimum": 1
        },
        "candidates": {
          "description": "Fix commits found in the range before de-duplication by patch-id.",
          "type": "integer",
          "minimum": 0
        },
        "duplicates": {
          "description": "Commits dropped as the same patch under another sha. A dual-branch topology carries the same fix two or three times; counting it twice corrupts the corpus.",
          "type": "integer",
          "minimum": 0
        }
      },
      "additionalProperties": false
    },
    "records": {
      "type": "array",
      "items": {
        "type": "object",
        "required": [
          "commit",
          "patchId",
          "verdict",
          "source",
          "removedTests",
          "runs"
        ],
        "properties": {
          "commit": {
            "$ref": "urn:claimspec:v1:common#/$defs/gitSha"
          },
          "patchId": {
            "description": "`git patch-id --stable` of the fix: the identity of the CHANGE rather than of the commit. A dual-branch topology carries the same fix under several shas, and counting it twice corrupts the corpus. Hex, 40 characters for a SHA-1 repository and 64 for a SHA-256 one; the commit sha when git could not compute one.",
            "type": "string",
            "pattern": "^[a-f0-9]{40}(?:[a-f0-9]{24})?$"
          },
          "subject": {
            "description": "The fix commit's subject line, for a human reading the corpus.",
            "type": "string",
            "maxLength": 512
          },
          "verdict": {
            "description": "`caught` = a remaining test failed by assertion on the reverted source, every run. `blind` = the suite stayed green on known-broken code. `nocover` = no test exercises the reverted files at all, which is worse than blind; it requires that at least one test file REMAINED after the fix's own were removed, otherwise nothing could be concluded and the verdict is `unverifiable` with reason `the-fix-shipped-the-only-test-file`. `unverifiable` = nothing could be concluded: the revert did not apply, the suite could not load, it timed out, or the commit only ADDS source (`no-prior-version` \u2014 there is no earlier behaviour to have been blind to, so it is not a bug the suite could have caught and it never enters a calibration). `flaky` = the runs disagreed, so nothing can be concluded.",
            "enum": [
              "caught",
              "blind",
              "nocover",
              "unverifiable",
              "flaky"
            ]
          },
          "reason": {
            "type": "string",
            "maxLength": 256
          },
          "source": {
            "description": "Source files reverted to the fix's parent.",
            "type": "array",
            "minItems": 1,
            "items": {
              "$ref": "urn:claimspec:v1:common#/$defs/repoPath"
            }
          },
          "removedTests": {
            "description": "Test files the fix shipped, removed before the run: the fix's own test proves nothing about what the suite knew before it.",
            "type": "array",
            "items": {
              "$ref": "urn:claimspec:v1:common#/$defs/repoPath"
            }
          },
          "ranTests": {
            "type": "integer",
            "minimum": 0
          },
          "faultClass": {
            "description": "The injected-fault class this real diff most resembles, derived mechanically from the diff shape. This is the join key between ground truth and a fault model: it is what lets P(this fault class is a real bug) be computed.",
            "$ref": "urn:claimspec:v1:common#/$defs/faultClass"
          },
          "runs": {
            "type": "array",
            "minItems": 1,
            "items": {
              "$ref": "urn:claimspec:v1:evidence#/$defs/testRun"
            }
          }
        },
        "additionalProperties": false
      }
    }
  },
  "additionalProperties": false
}
